topic_id,label,explanation,top_words,n_successful_passes,n_requested_passes,majority_count,candidate_labels
0,Heterogeneous accelerator workload scheduling and pooling,"Focuses on scheduling and pooling of heterogeneous accelerators (GPUs/APUs) to optimize utilization and performance across distributed clusters or VD pools. Representative patents describe dynamic job assignment, VD pool configuration/migration, and co‑scheduling of ML training jobs based on utilization metrics and platform performance.","performance, job, platform, devices, heterogeneous, ai, cluster, distributed, metrics, metric, utilization, pool, analysis, scheduler, service",3,3,1,Heterogeneous accelerator workload scheduling and pooling | Heterogeneous AI compute resource scheduler | Heterogeneous Accelerator Job Scheduler
1,Cross-PPU Page Ownership Management,"The documents describe determining and updating ownership states for memory pages and modifying page-table entries across parallel processing units (PPUs), including migrating pages and coalescing entries based on a page state directory (PSD). Top words like ""page"", ""page_table"", ""entry"", ""state"", ""memory_page"", and ""cache"" reflect page ownership/state tracking, page-table synchronization, and entry management. The technical focus is on cross‑processor memory ownership and page-table consistency rather than generic caching or packet handling.","state, table, cache, list, page, hash, entry, packet, descriptor, memory_page, check, operational, page_table, pages, entries",3,3,1,Cross-PPU Page Ownership Management | Page Table Ownership and Migration | PPU Page Migration and Ownership
2,IR-based GPU shader/kernel compilation,"Top words center on shader, kernel, intermediate, compiler, compiled, and binary—pointing to translation from source/IR to target executables. Documents describe merged shader generation to reduce control-flow divergence, pre-compiled intermediate libraries compiled into binaries for different processors, and tooling to generate GPU source and executables from CPU code, fitting an IR-driven compilation and cross-target binary generation theme.","shader, kernel, source, representation, language, compiled, kernels, intermediate, compiler, runtime, binary, loop, compiling, file, programming",3,3,1,IR-based GPU shader/kernel compilation | Intermediate representation for shader kernels | Multi-target shader and kernel compilation
3,SIMD Vectorized Stencil and Indexing,"Top words (vector, simd, register, consecutive, indices, iteration) point to vector/SIMD processing of ordered data and indices. Doc 1 describes loading stencil coefficients and consecutive data into vector registers for 1D stencil arithmetic, while Docs 2–3 describe data-parallel evaluation of indexed N-to-1 spatial correspondences on coprocessors, matching the vectorized indexing/stencil design focus.","vector, simd, index, register, registers, scalar, indices, iteration, point, order, sorted, single_data, consecutive, arithmetic, line",3,3,1,SIMD Vectorized Stencil and Indexing | SIMD Vectorized Indexed Stencil Operations | Register-Aware SIMD Stencil and Indexing
4,Tile-based pixel region compression and shading,"The documents and top words center on encoding and compressing per-tile pixel regions with pixel-region flags and bit-budget decisions (Document 1), along with hierarchical coarse/fine shading interpolation across pixels (Document 2) and scanline-aligned region subdivision for rasterization (Document 3). Top words like pixel, region, bit, shading, edge, and pixels indicate techniques for reducing pixel data and shading work via region-based compression and efficient rasterization.","pixel, pixels, region, depth, shading, individual, regions, bit, color, test, coverage, distinct, shape, graphics_data, edge",3,3,1,Tile-based pixel region compression and shading | Region-based pixel shading and compression | Tile-based pixel region compression
5,Frame buffer management and display synchronization,"Centres on frame_buffer and buffer management for rendering, compositing, and display timing to maintain smooth frame_rate and mitigate display delays. Representative documents describe reuse and resolution-scaling of frame buffers, time-shifting compositing/refresh to avoid buffer-swap stalls, and storing/combining color+alpha buffers for transparency blending.","frame, buffer, display, frame_buffer, graphics_data, frames, graphics_graphics, portions, image_frame, buffers, screen, rate, displaying, frame_rate, graphic",3,3,2,Frame-buffer management and display synchronization | Frame buffer management and display synchronization | Frame buffer management and display synchronization
6,Tile-based foveated rendering pipeline,"Top words (tile, pipeline, bin, render, upsampling) emphasize tile-oriented graphics processing. The documents describe foveation/variable-resolution rendering—binning vertices per tile, rendering tiles at reduced sizes (eye-buffer/foveation), upsampling, and generating GPU shader programs to apply effects.","render, tile, graphical, pass, tiles, rendered, pipeline, content, effect, scene, bin, user, user_interface, resolution, graphics_rendering",3,3,1,Tile-based foveated rendering pipeline | Tile-based foveated upsampling | Foveated tile-based rendering and upsampling
7,Multi-tenant GPU request scheduling,"Top words (request, host, server, client, manager, control, environment) emphasize request/host/service orchestration. The documents describe a multi-user manager allocating GPU/pixel processing per user, predicting per-request resource usage and associating requests with available GPU resources, and workers pulling execution requests from a controller to schedule concurrent GPU tasks. These combine into a theme of scheduling and resource allocation for multi-tenant GPU workloads.","request, host, server, user, client, remote, environment, service, requests, new, received, sending, manager, requested, control",3,3,1,Multi-tenant GPU request scheduling | Multi-tenant GPU Request Allocation | GPU resource allocation and scheduling
8,Priority-based GPU power and frequency capping,"Documents describe monitoring power/thermal thresholds and adjusting GPU utilization, operating frequency, and voltage based on workload priority and toggle rate. Top words (threshold, power, priority, frequency, utilization) reflect scheduling policies that cap lower-priority workloads to maintain maximum power/thermal limits. The label highlights the technical focus on priority-aware power and frequency control for GPUs.","threshold, power, priority, rate, frequency, scheduling, greater, usage, maximum, load, consumption, policy, control, utilization, equal",3,3,2,Priority-aware GPU power capping | Priority-based GPU power and frequency capping | Priority-based GPU power and frequency capping
9,Per-channel floating-point to fixed-point quantization,"Top words (layer, tensor, quantization, floating_point, precision, weights) indicate a focus on numeric precision at the layer/tensor level. The documents describe converting floating-point scale/batchnorm layers to fixed-point using per-channel quantization parameters, mapping those fixed-point layers to GEMM engines, and implementing mixed-precision multiply‑add hardware.","layer, neural, neural_network, tensor, weight, layers, weights, point, quantization, activation, tensors, floating, floating_point, precision, filter",3,3,1,Per-channel floating-point to fixed-point quantization | Channel-wise quantization for neural layers | Per-channel quantization to fixed-point
10,Hardware-aware node ordering and mapping,"Top words emphasize nodes, tree structure, traversal, parent/child links, and edges. The documents describe generating execution orders by mapping nodes to heterogeneous hardware (CPU/GPU/accelerator), training subtrees on GPUs, and mapping logical nodes onto many-core NoC resources, indicating a focus on scheduling, traversal, and placement of graph/tree nodes across hardware.","node, nodes, tree, child, edge, node_node, leaf, link, traversal, root, nodes_nodes, node_nodes, parent, nodes_node, building",3,3,1,Hardware-aware node ordering and mapping | Resource-aware node ordering and mapping | Node scheduling and mapping on accelerators
11,Thread-group prefix sums and shared-memory coordination,"Top words (thread, shared_memory, prefix, local/global_memory, queue) and documents detail parallel prefix-sum and radix-sort operations across cooperative thread arrays and methods for assigning and ordering threads to shared memory instances. The theme centers on inter-thread synchronization and shared/local memory coordination to support collective parallel primitives and avoid resource contention.","thread, threads, work, shared, local, shared_memory, queue, global, local_memory, sum, thread_thread, prefix, global_memory, number_threads, message",3,3,1,Thread-group prefix sums and shared-memory coordination | Cooperative thread shared-memory coordination | Cooperative thread prefix-sum with shared memory
12,Cloud virtual GPU provisioning and management,"Focuses on attaching, selecting, and migrating virtual GPUs (vgpu) implemented on physical GPUs for virtual machines in multi-tenant clouds, including elastic GPU classes. Representative documents describe intermediate drivers translating graphics calls and services that attach or change vGPU classes; top words (virtual, physical, vm, vgpu, hypervisor) reflect GPU virtualization and orchestration.","virtual, physical, vm, virtual_gpu, compute, machines, physical_gpu, virtual_machines, vgpu, additional, gpus, guest, virtual_graphics, gpu_virtual, hypervisor",3,3,1,Cloud virtual GPU provisioning and management | Elastic virtual GPU provisioning | Elastic vGPU provisioning and migration
13,Programmable systolic-array accelerator hardware,"Top words (accelerator, programmable, array, fpga, circuit, NoC) indicate hardware accelerators implemented as programmable arrays. Representative documents describe routing PCIe TLPs into a systolic array, NoC-coupled data-processing engine arrays, and traffic generators spanning programmable logic and arrays, showing a focus on integrated digital accelerator array design and interconnects.","accelerator, circuit, programmable, acceleration, accelerators, logic, hardware_accelerator, design, digital, array, circuitry, integrated, fpga, specific, gate",3,3,1,Programmable systolic-array accelerator hardware | Programmable systolic-array hardware accelerators | Integrated Programmable Accelerator Arrays
14,Graph embedding and mapping optimization,"Top words (graph, operators, edges, cost, optimization) and documents focus on embedding problem graphs onto constrained hardware graphs and transforming operators for execution. The patents describe partitioning/embedding subgraphs, assigning costs and tradeoffs for scheduling, and mapping fermionic operators to qubit interactions under connectivity constraints. Overall the theme is optimizing graph-to-hardware mappings and operator scheduling given architectural constraints.","graph, computational, candidate, cost, operator, quantum, architecture, optimization, optimized, constraint, chunk, operators, flow, optimal, edges",3,3,2,Graph embedding and mapping optimization | Graph-based hardware mapping optimization | Graph embedding and mapping optimization
15,GPU-optimized sparse matrix encoding,"Top words (matrix, array, row, multiplication, sparse, zero) and the documents describe identifying non-zero elements, generating a distribution matrix, and encoding sparse matrices into arrays. The focus is on data layouts and encodings that map sparse rows/columns to GPU parallel processing units to accelerate matrix operations (e.g., multiply-add, tridiagonal solves).","matrix, array, row, multiplication, rows, sparse, vector, column, zero, matrices, vectors, matrix_multiplication, kernel, columns, attention",3,3,1,GPU-optimized sparse matrix encoding | GPU sparse matrix data-layout and multiplication | GPU-optimized sparse matrix data layout
16,GPU Task Scheduling and Distribution,"Top words (task, gpu_task, task_gpu, data_object) and documents describe creating and ordering GPU task queues, obtaining real-time resource information, and selecting devices for task execution. Representative claims include a master device for resource-aware task allocation, GPU queue/memory-access timing analysis, and preemption/swap-in policies, indicating a technical focus on scheduling and distribution across GPUs and multiple processing devices.","task, object, objects, tasks, data_object, task_task, gpu_task, electronic, status, duration, data_objects, unified, selecting, task_gpu, development",3,3,1,GPU Task Scheduling and Distribution | Heterogeneous GPU task scheduling and allocation | GPU and Parallel Task Scheduling
17,Graphics driver command stream scheduling,"Topic centers on graphics drivers managing GPU command streams and command buffers—scheduling and resolving dependencies, atomically submitting streams, and using notifications based on hardware resource availability. The representative patents describe driver-driven atomic submission of command streams, monitoring internal buffers/interrupts, and coordinating parallel GPU engines via queues and wait operations.","command, commands, driver, stream, graphics_commands, buffer, graphics_driver, graphics_command, command_buffer, draw, command_stream, gpu_driver, buffers, commands_command, mode",3,3,1,Graphics driver command stream scheduling | GPU command stream scheduling and synchronization | Resource-Aware GPU Command Scheduling
18,View-dependent primitive visibility culling,"Top words (primitives, visibility, bounding, view, rays, voxel) and the documents describe GPU methods for determining which primitives are visible from one or more viewpoints and skipping rendering of non-visible primitives. Representative claims cover view-based visibility streams, depth/size thresholds, and temporal/bounding-polygon techniques for animated primitives to cull samples before pixel shading. The label captures the technical focus on view- and time-aware culling of geometry primitives.","primitives, primitive, surface, ray, volume, bounding, view, scene, space, rays, geometry, plane, visible, voxel, visibility",3,3,1,View-dependent primitive visibility culling | Temporal and Multi-view Primitive Culling | Multi-view primitive visibility culling
19,Logical-to-Physical GPU Memory Mapping,"Focuses on allocation and mapping of virtual memory addresses/pointers to physical GPU memory, including asynchronous allocation and memory pooling (top words: address, allocation, pointer, gpu_memory). Representative documents describe logical partitioning of GPU resources with mappings to physical servers, APIs for async memory allocation from pools, and topology-aware placement/migration with virtual-to-physical pointer mapping.","address, access, space, location, allocation, allocated, write, read, dedicated, pointer, gpu_memory, memory_memory, locations, range, memory_access",3,3,1,Logical-to-Physical GPU Memory Mapping | GPU memory allocation and virtual mapping | Virtualized distributed GPU memory management
20,Volumetric rendering via 2D textures,"Top words (texture, dimensional, texel, shader, samples, color) indicate texture-based sampling and mapping. Documents describe treating 3D/ multi-dimensional image data as flat 2D texture datasets for addressing, transforming/interpolating on GPU texture units, and using color channels/texture memory for CT back-projection. The technical focus is on implementing volumetric rendering and processing by mapping volumes onto 2D textures and leveraging GPU texture hardware.","texture, dimensional, color, sample, fragment, map, channel, textures, location, shader, samples, transformation, texture_data, texel, space",3,3,1,Volumetric rendering via 2D textures | Texture-Mapped Volume Rendering and Registration | Multi-dimensional GPU Texture Mapping
21,Batched GPU Mesh and Particle Updates,"Top words (batch, mesh, grid, update, particle, dynamic) indicate grouping of computation into batches for updating mesh/particle states. Representative documents describe GPU-based face-batch determination for overset/moving grids, interpolation and multi-physics domain division, and parallel processing units aggregating and updating estimates, matching a design focus on batched, GPU-accelerated simulation updates.","batch, initial, graphic, simulation, grid, mesh, updated, static, particle, update, dynamic, batches, calculating, engine, updating",3,3,1,Batched GPU Mesh and Particle Updates | GPU mesh overset grid batching | Batched GPU overset mesh simulation
22,GPU graphics-memory block allocation and reuse,"Top words focus on blocks, memory_addresses, allocated and variables, while documents detail GPU memory defragmentation (migrating allocated blocks into target idle blocks), graphics-memory reuse across concurrent streams, and copying block data/addresses between CPU and multiple GPUs. The common technical theme is management of GPU graphics-memory blocks—allocation, reuse, and compaction/defragmentation—to optimize device memory usage and concurrency.","block, blocks, variable, variables, graphics_memory, act, lower, offset, thread_blocks, memory_block, data_block, candidate, addresses, memory_addresses, allocated",3,3,1,GPU graphics-memory block allocation and reuse | GPU graphics memory block management | GPU memory block defragmentation and reuse
23,Runtime API for accelerator resource management,"Top words like “api”, “programming_interface”, “synchronization”, “context”, and “run” and the documents show APIs that locate/load program portions, virtualize GPUs for VMs, and configure parallel 5G‑NR operations. Together these point to runtime interfaces that manage accelerator resources, scheduling/communication, and synchronization across execution contexts rather than a generic software topic.","api, software, mode, end, algorithm, context, programming, synchronization, th, programming_interface, running, version, run, event, communication",3,3,1,Runtime API for accelerator resource management | API-driven Accelerator Virtualization and Scheduling | Accelerator API for resource and execution
24,GPU-accelerated multi-stream video processing,"Top words emphasize video/streams/encoding/decoding/frames and video_memory, and the documents describe GPU-based thread-parallel decoding, shader partitioning between devices, and dynamic GPU memory transfers of viewpoint-indexed video datasets. Together these point to designs for real-time, GPU-accelerated handling of multiple encoded video streams and frame-level processing.","video, image_data, images, resolution, stream, content, encoding, decoding, transformed, streams, encoder, purpose, encoded, frames, video_memory",3,3,1,GPU-accelerated multi-stream video processing | GPU-accelerated video streaming and decoding | GPU-accelerated multi-stream video decoding
25,SIMD Partitioning for MIMD Execution,"Representative documents describe establishing SIMD partitions of compute_nodes and booting those partitions in MIMD mode so that MIMD programs can run on an originally SIMD-only machine. Top words like partition, compute, simd, partitioning, and data_parallel emphasize partitioned compute nodes and mode switching from SIMD to MIMD. The label emphasizes the hardware/software design focus on partitioning and mode conversion to enable mixed parallel execution.","sub, compute, partition, computation, partitions, simd, compute_nodes, data_parallel, routine, compute_kernel, partitioned, mode, partitioning, requests, nodes",3,3,2,SIMD Partitioning for MIMD Execution | SIMD Partitioning for MIMD Execution | Partitioned SIMD for hybrid MIMD execution
26,Heterogeneous Memory Transfer Optimization,"Focuses on optimizing data layout, formatting, compression and transfers (e.g., padding/alignment) for queries and file/metadata across heterogeneous processors and memory arenas. Representative documents describe adding padding for SIMT execution, generating fine-grained data-transfer instructions between execution sections/blocks, and chunking/copying data to minimize cross-arena transfer time, which aligns with top words like query, compressed, format, input_data, transfer, and data_memory.","query, compressed, format, input_data, data_data, reference, database, compression, metadata, file, transfer, data_memory, copy, output_data, records",3,3,1,"Heterogeneous Memory Transfer Optimization | Memory Transfer and Data Formatting Optimization | Data transfer, formatting and compression"
27,On-chip Tiling for Depthwise-Pointwise Convs,"Top words (feature_map, convolution, depthwise, pointwise, channels, intermediate) highlight convolutional feature tiling and channel handling. The documents describe reading feature maps/kernels and computing depthwise then pointwise outputs for a predetermined number p of points based on on‑chip memory, MAC units, and splicing, indicating a hardware-aware tiling/scheduling strategy for depthwise-pointwise convolutions.","feature, map, convolution, calculation, geometry, stage, ml, cell, features, intermediate, cells, partial, points, channels, feature_map",3,3,1,On-chip Tiling for Depthwise-Pointwise Convs | Memory-aware depthwise-pointwise convolution tiling | On-chip Tiling for Separable Convolutions
28,Distributed model partitioning on heterogeneous accelerators,"Top words emphasize model training and inference, while Doc1 shows quantized model transformation for embedded inference. Doc2 describes exchanging embeddings and training across different processor types, and Doc3 details partitioning networks across multiple accelerator units based on compute vs memory intensity. The theme centers on distributing and adapting models across heterogeneous accelerator hardware for training and inference.","model, learning, training, learning_model, inference, neural, network_model, models, deep, deep_learning, trained, neural_network, training_data, artificial, dataset",3,3,1,Distributed model partitioning on heterogeneous accelerators | Heterogeneous hardware model training and deployment | Model training across heterogeneous devices
29,Triangle-based GPU Bezier Curve Rendering,"Documents and top words center on using GPUs to render quadratic Bézier curves by mapping each curve to a canonical form represented as a triangle whose three vertices are control points. Methods describe sending vertex coordinates to the GPU, evaluating barycentric/coordinate functions in shaders, and reducing/processing vertex points for efficient tessellation.","gpus, vertex, point, segment, points, path, vertices, segments, coordinate, line, curve, coordinates, triangle, vertex_shader, shader",3,3,1,Triangle-based GPU Bezier Curve Rendering | GPU triangle-based Bézier curve rendering | GPU triangle-based Bézier rasterization
